Event ID,Paragraph ID,Article ID,Head labels,Relation label,Tail labels,Head text,Relation text,Tail text,Sentence text,Group_relation_label
651,140,12,treatment,AND,treatment,strapping the buttocks together with tape,facilitates,spontaneous resolution of the prolapse,strapping the buttocks together with tape facilitates spontaneous resolution of the prolapse,AND
652,141,12,condition,CAUSES,treatment,simple mucosal prolapse in adults,can be excised,excess mucosa,simple mucosal prolapse in adults can be excised excess mucosa,CAUSES
653,141,12,condition,CAUSES,treatment,procidentia,may require,rectopexy,procidentia may require rectopexy,CAUSES
654,141,12,treatment,IMPLIES,condition,rectopexy,in which,the rectum is mobilized and fixed to the sacrum,rectopexy in which the rectum is mobilized and fixed to the sacrum,IMPLIES
655,141,12,condition,THRESHOLD,treatment,patients who can tolerate a laparotomy,may require,rectopexy,patients who can tolerate a laparotomy may require rectopexy,THRESHOLD
656,141,12,condition,THRESHOLD,treatment,patients who cannot tolerate a laparotomy,can be considered,"perineal operations (e.g., Delorme or Altemeier procedure)","patients who cannot tolerate a laparotomy can be considered perineal operations (e.g., Delorme or Altemeier procedure)",THRESHOLD
657,143,13,"treatment, procedure",IMPLIES,"equipment, technology",CT scan,uses,x-ray source and x-ray detector,CT scan uses x-ray source and x-ray detector,IMPLIES
658,143,13,"equipment, technology",CAUSES,"outcome, benefit",more detectors,allow,quicker scanning and higher-resolution images,more detectors allow quicker scanning and higher-resolution images,CAUSES
659,143,13,"outcome, benefit",IMPLIES,"importance, application",higher-resolution images,are important for,imaging the heart and abdominal organs,higher-resolution images are important for imaging the heart and abdominal organs,IMPLIES
660,144,13,"treatment, diagnostic tool",IMPLIES,"condition, diagnostic outcome",x-ray images taken from multiple angles,implies,2-dimensional images (tomograms) representing a slice of the body,x-ray images taken from multiple angles implies 2-dimensional images (tomograms) representing a slice of the body,IMPLIES
661,145,13,"procedure, technology",IMPLIES,"procedure, technology",table moves incrementally and stops when each scan (slice) is taken,implies,data are collected in a non-continuous sequence,table moves incrementally and stops when each scan (slice) is taken implies data are collected in a non-continuous sequence,IMPLIES
662,145,13,"procedure, technology",IMPLIES,"procedure, technology",table moves continuously during scanning,implies,data are collected in a spiral or helical sequence,table moves continuously during scanning implies data are collected in a spiral or helical sequence,IMPLIES
663,145,13,"procedure, technology",CAUSES,"procedure, technology",patient is moving in a straight line and the detectors are moving in a circle,causes,data are collected in a spiral or helical sequence around the patient,patient is moving in a straight line and the detectors are moving in a circle causes data are collected in a spiral or helical sequence around the patient,CAUSES
664,146,13,"treatment, imaging technique",IMPLIES,imaging technique,radionuclide scanning,can be applied to,tomographic imaging,radionuclide scanning can be applied to tomographic imaging,IMPLIES
665,146,13,imaging technique,CAUSES,imaging technique,tomographic imaging,convert into,tomographic images,tomographic imaging convert into tomographic images,CAUSES
666,146,13,imaging technique,AND,imaging technique,single-photon emission CT (SPECT),examples include,positron-emission tomography (PET),single-photon emission CT (SPECT) examples include positron-emission tomography (PET),AND
667,147,13,"treatment, diagnostic tool",IMPLIES,"treatment, diagnostic tool",CT,provides better differentiation between various soft-tissue densities than do,x-rays,CT provides better differentiation between various soft-tissue densities than do x-rays,IMPLIES
668,147,13,"treatment, diagnostic tool",CAUSES,"preference, diagnostic tool",CT provides so much more information,it is preferred to,"conventional x-rays for imaging most intracranial, head and neck, spinal, intrathoracic, and intra-abdominal structures","CT provides so much more information it is preferred to conventional x-rays for imaging most intracranial, head and neck, spinal, intrathoracic, and intra-abdominal structures",CAUSES
669,147,13,"diagnostic tool, imaging technique",IMPLIES,"surgical planning, treatment",Three-dimensional images of lesions,can help,surgeons plan surgery,Three-dimensional images of lesions can help surgeons plan surgery,IMPLIES
670,148,13,"treatment, diagnostic tool",IMPLIES,condition,CT,is the most accurate study for detecting and localizing,urinary calculi,CT is the most accurate study for detecting and localizing urinary calculi,IMPLIES
671,149,13,"treatment, procedure",IMPLIES,"condition, diagnosis",Noncontrast CT,is used to detect,acute hemorrhage in the brain,Noncontrast CT is used to detect acute hemorrhage in the brain,IMPLIES
672,149,13,"treatment, procedure",IMPLIES,"condition, diagnosis",Noncontrast CT,is used to detect,urinary calculi,Noncontrast CT is used to detect urinary calculi,IMPLIES
673,149,13,"treatment, procedure",IMPLIES,"condition, diagnosis",Noncontrast CT,is used to detect,lung nodules,Noncontrast CT is used to detect lung nodules,IMPLIES
674,149,13,"treatment, procedure",IMPLIES,"condition, diagnosis",Noncontrast CT,is used to characterize,bone fractures and other skeletal abnormalities,Noncontrast CT is used to characterize bone fractures and other skeletal abnormalities,IMPLIES
675,149,13,"treatment, procedure",IMPLIES,"condition, diagnosis",IV contrast CT,is used to improve imaging of,tumors,IV contrast CT is used to improve imaging of tumors,IMPLIES
676,149,13,"treatment, procedure",IMPLIES,"condition, diagnosis",IV contrast CT,is used to improve imaging of,infection,IV contrast CT is used to improve imaging of infection,IMPLIES
677,149,13,"treatment, procedure",IMPLIES,"condition, diagnosis",IV contrast CT,is used to improve imaging of,inflammation,IV contrast CT is used to improve imaging of inflammation,IMPLIES
678,149,13,"treatment, procedure",IMPLIES,"condition, diagnosis",IV contrast CT,is used to improve imaging of,trauma in soft tissues,IV contrast CT is used to improve imaging of trauma in soft tissues,IMPLIES
679,149,13,"treatment, procedure",IMPLIES,"condition, diagnosis",IV contrast CT,is used to assess,the vascular system,IV contrast CT is used to assess the vascular system,IMPLIES
680,149,13,"treatment, procedure",IMPLIES,"condition, diagnosis",IV contrast CT,is used when,pulmonary embolism is suspected,IV contrast CT is used when pulmonary embolism is suspected,IMPLIES
681,149,13,"treatment, procedure",IMPLIES,"condition, diagnosis",IV contrast CT,is used when,aortic aneurysm is suspected,IV contrast CT is used when aortic aneurysm is suspected,IMPLIES
682,149,13,"treatment, procedure",IMPLIES,"condition, diagnosis",IV contrast CT,is used when,aortic dissection is suspected,IV contrast CT is used when aortic dissection is suspected,IMPLIES
683,150,13,"treatment, procedure",USES,"treatment, substance",abdominal imaging,uses,oral or occasionally rectal contrast,abdominal imaging uses oral or occasionally rectal contrast,USES
684,150,13,"treatment, procedure",USES,"treatment, substance",abdominal imaging,uses,gas,abdominal imaging uses gas,USES
685,150,13,"treatment, substance",CAUSES,"symptom, condition",gas,causes,distend the lower gastrointestinal (GI) tract,gas causes distend the lower gastrointestinal (GI) tract,CAUSES
686,150,13,"treatment, substance",IMPLIES,"diagnostic, procedure",contrast in the GI tract,implies,distinguish the GI tract from surrounding structures,contrast in the GI tract implies distinguish the GI tract from surrounding structures,IMPLIES
687,150,13,"treatment, substance",STANDARD,"treatment, substance",standard oral contrast,is,barium-based,standard oral contrast is barium-based,OR
688,150,13,"condition, risk factor",THRESHOLD,"treatment, substance",intestinal perforation,threshold for using,low-osmolar iodinated contrast,intestinal perforation threshold for using low-osmolar iodinated contrast,THRESHOLD
689,151,13,"treatment, procedure",IMPLIES,"symptom, condition",Virtual (CT) colonoscopy,can show,colon polyps and colon mucosal lesions as small as 5 mm,Virtual (CT) colonoscopy can show colon polyps and colon mucosal lesions as small as 5 mm,IMPLIES
690,151,13,"treatment, procedure",IMPLIES,"treatment, procedure",Virtual (CT) colonoscopy,is an alternative to,conventional colonoscopy,Virtual (CT) colonoscopy is an alternative to conventional colonoscopy,IMPLIES
691,151,13,"treatment, procedure",CAUSES,symptom,Virtual (CT) colonoscopy,is more comfortable than,conventional colonoscopy,Virtual (CT) colonoscopy is more comfortable than conventional colonoscopy,CAUSES
692,151,13,"treatment, procedure",IMPLIES,"treatment, procedure",Virtual (CT) colonoscopy,"provides clearer, more detailed images than",conventional lower gastrointestinal (GI) series,"Virtual (CT) colonoscopy provides clearer, more detailed images than conventional lower gastrointestinal (GI) series",IMPLIES
693,151,13,"treatment, procedure",NEGATES,"treatment, procedure",Virtual (CT) colonoscopy,does not require,conscious sedation,Virtual (CT) colonoscopy does not require conscious sedation,NEGATES
694,151,13,"treatment, procedure",IMPLIES,condition,Virtual (CT) colonoscopy,can show,extrinsic soft-tissue masses,Virtual (CT) colonoscopy can show extrinsic soft-tissue masses,IMPLIES
695,151,13,"treatment, procedure",IMPLIES,condition,Virtual (CT) colonoscopy,visualizes the entire colon,"in contrast, conventional colonoscopy does not allow the right colon to be evaluated completely in about 1 in 10 patients","Virtual (CT) colonoscopy visualizes the entire colon in contrast, conventional colonoscopy does not allow the right colon to be evaluated completely in about 1 in 10 patients",IMPLIES
696,152,13,"condition, procedure",CAUSES,"disadvantage, limitation",virtual colonoscopy,include,inability to biopsy the polyps at the time of examination,virtual colonoscopy include inability to biopsy the polyps at the time of examination,CAUSES
697,152,13,"condition, procedure",CAUSES,"disadvantage, risk factor",virtual colonoscopy,include,radiation exposure,virtual colonoscopy include radiation exposure,CAUSES
698,153,13,"treatment, procedure",USES,"treatment, substance",CT enterography,uses,low-density oral contrast agent,CT enterography uses low-density oral contrast agent,USES
699,154,13,"treatment, diagnostic procedure",IMPLIES,condition,CT enterography,is used to identify,inflammatory bowel disease,CT enterography is used to identify inflammatory bowel disease,IMPLIES
700,154,13,diagnostic procedure,AND,treatment,CT enterography,often involves,using IV contrast,CT enterography often involves using IV contrast,AND
701,154,13,diagnostic procedure,IMPLIES,procedure,CT enterography,obtains,thin-slice high-resolution CT images of the entire abdomen and pelvis,CT enterography obtains thin-slice high-resolution CT images of the entire abdomen and pelvis,IMPLIES
702,154,13,procedure,IMPLIES,procedure,thin-slice high-resolution CT images,are reconstructed in,"multiple anatomic planes, forming 3-dimensional reconstructions","thin-slice high-resolution CT images are reconstructed in multiple anatomic planes, forming 3-dimensional reconstructions",IMPLIES
703,155,13,"treatment, diagnostic procedure",IMPLIES,"condition, disorder",CT enterography,can be used to detect and evaluate,disorders other than inflammatory bowel disease,CT enterography can be used to detect and evaluate disorders other than inflammatory bowel disease,IMPLIES
704,155,13,"condition, disorder",INCLUDES,"condition, obstruction",disorders other than inflammatory bowel disease,including,lesions obstructing the small intestine,disorders other than inflammatory bowel disease including lesions obstructing the small intestine,IMPLIES
705,155,13,"condition, disorder",INCLUDES,"condition, tumor",disorders other than inflammatory bowel disease,including,tumors,disorders other than inflammatory bowel disease including tumors,IMPLIES
706,155,13,"condition, disorder",INCLUDES,"condition, abscess",disorders other than inflammatory bowel disease,including,abscesses,disorders other than inflammatory bowel disease including abscesses,IMPLIES
707,155,13,"condition, disorder",INCLUDES,"condition, fistula",disorders other than inflammatory bowel disease,including,fistulas,disorders other than inflammatory bowel disease including fistulas,IMPLIES
708,155,13,"condition, disorder",INCLUDES,"condition, bleeding source",disorders other than inflammatory bowel disease,including,bleeding sources,disorders other than inflammatory bowel disease including bleeding sources,IMPLIES
709,156,13,"treatment, procedure",IMPLIES,"condition, diagnostic tool",CT IV pyelography (CT IVP) or urography,involves,"IV contrast injection to produce detailed images of the kidneys, ureters, and bladder","CT IV pyelography (CT IVP) or urography involves IV contrast injection to produce detailed images of the kidneys, ureters, and bladder",IMPLIES
710,156,13,"treatment, procedure",CAUSES,process,IV contrast,concentrates in,"the kidneys and is excreted into the renal-collecting structures, ureters, and bladder","IV contrast concentrates in the kidneys and is excreted into the renal-collecting structures, ureters, and bladder",CAUSES
711,156,13,"treatment, procedure",IMPLIES,outcome,Multiple CT images are obtained,producing,high-resolution images of the urinary tract during maximal contrast opacification,Multiple CT images are obtained producing high-resolution images of the urinary tract during maximal contrast opacification,IMPLIES
712,156,13,"treatment, procedure",REPLACES,"treatment, procedure",CT urography,has replaced,conventional IV urography in most institutions,CT urography has replaced conventional IV urography in most institutions,CLASSIFICATION
713,157,13,"treatment, procedure",IMPLIES,"treatment, procedure",CT angiography,"is a safer, less invasive alternative to",conventional angiography,"CT angiography is a safer, less invasive alternative to conventional angiography",IMPLIES
714,158,13,"treatment, risk factor",CAUSES,risk factor,multiple CT scans,placing the patient at potential risk,high total radiation dose,multiple CT scans placing the patient at potential risk high total radiation dose,CAUSES
715,158,13,condition,IMPLIES,treatment,recurrent urinary tract stones,are most likely to have,multiple CT scans,recurrent urinary tract stones are most likely to have multiple CT scans,IMPLIES
716,158,13,condition,IMPLIES,treatment,major trauma,are most likely to have,multiple CT scans,major trauma are most likely to have multiple CT scans,IMPLIES
717,158,13,treatment,THRESHOLD,risk factor,one abdomen/pelvis CT,is equal to approximately,385 single-view chest x-rays,one abdomen/pelvis CT is equal to approximately 385 single-view chest x-rays,THRESHOLD
718,158,13,risk factor,NEGATES,benefit,risk of radiation exposure,versus,benefit of the examination,risk of radiation exposure versus benefit of the examination,NEGATES
719,159,13,"treatment, procedure",IMPLIES,risk factor,CT scanning,use the lowest radiation dose possible,lowered radiation exposure,CT scanning use the lowest radiation dose possible lowered radiation exposure,IMPLIES
720,159,13,"treatment, procedure",CAUSES,risk factor,Modern CT scanners and revised imaging protocols,have dramatically lowered,radiation exposure from CT,Modern CT scanners and revised imaging protocols have dramatically lowered radiation exposure from CT,CAUSES
721,159,13,"treatment, procedure",IMPLIES,"treatment, procedure","newer, investigational methods",evaluating the use of even much lower radiation doses,certain CT scans and certain indications,"newer, investigational methods evaluating the use of even much lower radiation doses certain CT scans and certain indications",IMPLIES
722,159,13,"treatment, procedure",THRESHOLD,risk factor,radiation doses,comparable to,radiation delivered by x-rays,radiation doses comparable to radiation delivered by x-rays,THRESHOLD
723,160,13,"treatment, risk factor",CAUSES,"condition, symptom",IV contrast,has certain risks,adverse effects,IV contrast has certain risks adverse effects,CAUSES
724,160,13,"treatment, risk factor",CAUSES,condition,Barium extravasation,can induce,severe inflammation in the peritoneal cavity,Barium extravasation can induce severe inflammation in the peritoneal cavity,CAUSES
725,160,13,"treatment, risk factor",IMPLIES,condition,risk of intestinal perforation,implies use of,iodinated oral contrast agents,risk of intestinal perforation implies use of iodinated oral contrast agents,IMPLIES
726,160,13,"treatment, risk factor",CAUSES,condition,Aspiration of iodinated contrast agents,can induce,severe chemical pneumonitis,Aspiration of iodinated contrast agents can induce severe chemical pneumonitis,CAUSES
727,160,13,"treatment, risk factor",CAUSES,condition,Barium retained in the intestinal tract,can cause,intestinal obstruction,Barium retained in the intestinal tract can cause intestinal obstruction,CAUSES
728,161,14,condition,CAUSES,symptom,Hemorrhoids,Symptoms include,irritation and bleeding,Hemorrhoids Symptoms include irritation and bleeding,CAUSES
729,161,14,condition,CAUSES,symptom,Thrombosed hemorrhoids,are usually,painful,Thrombosed hemorrhoids are usually painful,CAUSES
730,161,14,condition,DIAGNOSED BY,procedure,Hemorrhoids,Diagnosis is by,inspection or anoscopy,Hemorrhoids Diagnosis is by inspection or anoscopy,RECOMMENDATION
731,161,14,condition,TREATED WITH,treatment,Hemorrhoids,Treatment is,"symptomatic or with rubber banding, injection sclerotherapy, infrared photocoagulation, or sometimes surgery","Hemorrhoids Treatment is symptomatic or with rubber banding, injection sclerotherapy, infrared photocoagulation, or sometimes surgery",TREATMENT
732,162,14,"condition, risk factor",CAUSES,condition,Increased pressure in the veins of the anorectal area,leads to,hemorrhoids,Increased pressure in the veins of the anorectal area leads to hemorrhoids,CAUSES
733,162,14,risk factor,CAUSES,condition,pregnancy,may result in,increased pressure in the veins of the anorectal area,pregnancy may result in increased pressure in the veins of the anorectal area,CAUSES
734,162,14,risk factor,CAUSES,condition,frequent heavy lifting,may result in,increased pressure in the veins of the anorectal area,frequent heavy lifting may result in increased pressure in the veins of the anorectal area,CAUSES
735,162,14,risk factor,CAUSES,condition,repeated straining during defecation,may result in,increased pressure in the veins of the anorectal area,repeated straining during defecation may result in increased pressure in the veins of the anorectal area,CAUSES
736,162,14,condition,CAUSES,risk factor,constipation,leads to,repeated straining during defecation,constipation leads to repeated straining during defecation,CAUSES
737,162,14,condition,IMPLIES,condition,hemorrhoids,may be,external or internal,hemorrhoids may be external or internal,IMPLIES
738,162,14,condition,CAUSES,condition,increased blood pressure in the portal vein,results in,rectal varices,increased blood pressure in the portal vein results in rectal varices,CAUSES
739,162,14,condition,NEGATES,condition,rectal varices,are distinct from,hemorrhoids,rectal varices are distinct from hemorrhoids,NEGATES
740,163,14,condition,CAUSES,symptom,External hemorrhoids,"may become thrombosed, resulting in","painful, purplish swelling","External hemorrhoids may become thrombosed, resulting in painful, purplish swelling",CAUSES
741,163,14,condition,CAUSES,symptom,Thrombosed external hemorrhoids,resulting in,"painful, purplish swelling","Thrombosed external hemorrhoids resulting in painful, purplish swelling",CAUSES
742,163,14,condition,CAUSES,symptom,External hemorrhoids,"Rarely, they ulcerate and cause",minor bleeding,"External hemorrhoids Rarely, they ulcerate and cause minor bleeding",CAUSES
743,163,14,condition,CAUSES,difficulty,External hemorrhoids,Cleansing the anal region may be,difficult,External hemorrhoids Cleansing the anal region may be difficult,CAUSES
744,164,14,condition,CAUSES,symptom,Internal hemorrhoids,typically manifest with,bleeding after defecation,Internal hemorrhoids typically manifest with bleeding after defecation,CAUSES
745,164,14,condition,CAUSES,symptom,Internal hemorrhoids,sometimes cause,mucus discharge,Internal hemorrhoids sometimes cause mucus discharge,CAUSES
746,164,14,condition,CAUSES,symptom,Internal hemorrhoids,sometimes cause,a sensation of incomplete evacuation,Internal hemorrhoids sometimes cause a sensation of incomplete evacuation,CAUSES
747,164,14,condition,NEGATES,symptom,Internal hemorrhoids,are not as painful as,thrombosed external hemorrhoids,Internal hemorrhoids are not as painful as thrombosed external hemorrhoids,NEGATES
748,165,14,condition,CAUSES,symptom,Strangulated hemorrhoids,cause,pain,Strangulated hemorrhoids cause pain,CAUSES
749,165,14,condition,CAUSES,condition,Strangulated hemorrhoids,followed by,necrosis,Strangulated hemorrhoids followed by necrosis,CAUSES
750,165,14,condition,CAUSES,condition,Strangulated hemorrhoids,followed by,ulceration,Strangulated hemorrhoids followed by ulceration,CAUSES
751,165,14,condition,CAUSES,condition,necrosis,and,ulceration,necrosis and ulceration,CAUSES
752,166,14,"condition, symptom",IMPLIES,condition,painless or bleeding hemorrhoids,evaluated by,anoscopy,painless or bleeding hemorrhoids evaluated by anoscopy,IMPLIES
753,166,14,symptom,IMPLIES,condition,rectal bleeding,should be attributed to,hemorrhoids,rectal bleeding should be attributed to hemorrhoids,IMPLIES
754,166,14,condition,NEGATES,condition,hemorrhoids,only after more serious conditions are excluded,more serious conditions,hemorrhoids only after more serious conditions are excluded more serious conditions,NEGATES
755,166,14,condition,THRESHOLD,diagnostic procedure,more serious conditions,excluded by,sigmoidoscopy or colonoscopy,more serious conditions excluded by sigmoidoscopy or colonoscopy,THRESHOLD
756,167,14,"condition, symptom",IMPLIES,"treatment, guideline",Internal hemorrhoids classified by grade,can help guide,treatment,Internal hemorrhoids classified by grade can help guide treatment,IMPLIES
757,168,14,"condition, symptom",IMPLIES,treatment,hemorrhoids,Symptomatic treatment of,"stool softeners, warm sitz baths, anesthetic ointments containing lidocaine, or witch hazel compresses","hemorrhoids Symptomatic treatment of stool softeners, warm sitz baths, anesthetic ointments containing lidocaine, or witch hazel compresses",IMPLIES
758,168,14,"condition, symptom",CAUSES,symptom,thrombosed external hemorrhoid,Pain caused by,pain,thrombosed external hemorrhoid Pain caused by pain,CAUSES
759,168,14,symptom,IMPLIES,treatment,pain,can be treated with,nonsteroidal anti-inflammatory drugs,pain can be treated with nonsteroidal anti-inflammatory drugs,IMPLIES
760,169,14,"condition, symptom",CAUSES,treatment,grades I and II internal hemorrhoids,can often be treated effectively with,office-based procedures,grades I and II internal hemorrhoids can often be treated effectively with office-based procedures,CAUSES
761,169,14,"condition, symptom",CAUSES,treatment,grade III internal hemorrhoids not responding to symptomatic treatment,can often be treated effectively with,office-based procedures,grade III internal hemorrhoids not responding to symptomatic treatment can often be treated effectively with office-based procedures,CAUSES
762,169,14,treatment,CAUSES,"condition, symptom",Injection sclerotherapy with 5% phenol in vegetable oil or other sclerosing agents,can be used to treat,bleeding internal hemorrhoids,Injection sclerotherapy with 5% phenol in vegetable oil or other sclerosing agents can be used to treat bleeding internal hemorrhoids,CAUSES
763,169,14,treatment,CAUSES,"condition, symptom",Rubber band ligation,is used for,"larger, prolapsing internal hemorrhoids, bleeding internal hemorrhoids, or those that do not respond to conservative management","Rubber band ligation is used for larger, prolapsing internal hemorrhoids, bleeding internal hemorrhoids, or those that do not respond to conservative management",CAUSES
764,169,14,treatment,CAUSES,"condition, symptom",Infrared photocoagulation,is useful for ablating,"nonprolapsing, bleeding internal hemorrhoids, or hemorrhoids that are not cured with rubber band ligation","Infrared photocoagulation is useful for ablating nonprolapsing, bleeding internal hemorrhoids, or hemorrhoids that are not cured with rubber band ligation",CAUSES
765,170,14,"condition, treatment",REQUIRES,treatment,Patients who do not respond to other forms of therapy and for those who have grade IV internal hemorrhoids,is required for,Surgical hemorrhoidectomy,Patients who do not respond to other forms of therapy and for those who have grade IV internal hemorrhoids is required for Surgical hemorrhoidectomy,THRESHOLD
766,170,14,treatment,CAUSES,symptom,Surgical hemorrhoidectomy,causes,Significant postoperative pain,Surgical hemorrhoidectomy causes Significant postoperative pain,CAUSES
767,170,14,treatment,CAUSES,symptom,Surgical hemorrhoidectomy,causes,Urinary retention,Surgical hemorrhoidectomy causes Urinary retention,CAUSES
768,170,14,treatment,CAUSES,symptom,Surgical hemorrhoidectomy,causes,Constipation,Surgical hemorrhoidectomy causes Constipation,CAUSES
769,170,14,treatment,ALTERNATIVE_TO,treatment,Stapled hemorrhoidopexy,is an alternative procedure for,Surgical hemorrhoidectomy,Stapled hemorrhoidopexy is an alternative procedure for Surgical hemorrhoidectomy,CLASSIFICATION
