Event ID,Paragraph ID,Article ID,Head labels,Relation label,Tail labels,Head text,Relation text,Tail text,Sentence text,Group_relation_label
1,1,1,"treatment, diagnostic procedure",AND,"condition, diagnostic procedure",Flexible endoscopes equipped with video cameras,can be used to view,the upper gastrointestinal tract from pharynx to proximal duodenum and the lower gastrointestinal tract from anus to cecum,Flexible endoscopes equipped with video cameras can be used to view the upper gastrointestinal tract from pharynx to proximal duodenum and the lower gastrointestinal tract from anus to cecum,AND
2,1,1,"treatment, diagnostic procedure",AND,"condition, diagnostic procedure","specialized, longer enteroscopes",can be used to assess,the deeper parts of the jejunum and ileum,"specialized, longer enteroscopes can be used to assess the deeper parts of the jejunum and ileum",AND
3,1,1,"treatment, diagnostic procedure",AND,"treatment, diagnostic procedure",endoscopy,can combine,diagnosis and therapy in one procedure,endoscopy can combine diagnosis and therapy in one procedure,AND
4,1,1,"treatment, diagnostic procedure",IMPLIES,advantage,endoscopy,gives,a significant advantage over studies that provide only imaging,endoscopy gives a significant advantage over studies that provide only imaging,IMPLIES
5,1,1,"treatment, diagnostic procedure",NEGATES,disadvantage,endoscopy,often outweighs,higher cost and need for sedation,endoscopy often outweighs higher cost and need for sedation,NEGATES
6,2,1,"procedure, treatment",IMPLIES,treatment,Endoscopy,generally requires,IV sedation,Endoscopy generally requires IV sedation,IMPLIES
7,2,1,"procedure, treatment",NEGATES,treatment,Anoscopy and sigmoidoscopy,generally require no,sedation,Anoscopy and sigmoidoscopy generally require no sedation,NEGATES
8,2,1,procedure,CAUSES,"complication, risk factor",Endoscopy,complication rate,0.1 to 0.2%,Endoscopy complication rate 0.1 to 0.2%,CAUSES
9,2,1,procedure,CAUSES,"complication, risk factor",Endoscopy,mortality rate,0.03%,Endoscopy mortality rate 0.03%,CAUSES
10,2,1,"medication, treatment",CAUSES,"complication, symptom",Medication,related complications,respiratory depression,Medication related complications respiratory depression,CAUSES
11,2,1,procedure,CAUSES,"complication, symptom",Procedural complications,include,"aspiration, perforation, significant bleeding","Procedural complications include aspiration, perforation, significant bleeding",CAUSES
12,2,1,procedure,CAUSES,"complication, risk factor",Screening or surveillance colonoscopy,complications include,"myocardial infarction, stroke, serious pulmonary events","Screening or surveillance colonoscopy complications include myocardial infarction, stroke, serious pulmonary events",CAUSES
13,2,1,procedure,THRESHOLD,risk factor,Screening or surveillance colonoscopy,complication rate is no higher than,"other low-risk procedures (joint injection, aspiration, lithotripsy, arthroscopy, carpal tunnel or cataract surgery)","Screening or surveillance colonoscopy complication rate is no higher than other low-risk procedures (joint injection, aspiration, lithotripsy, arthroscopy, carpal tunnel or cataract surgery)",THRESHOLD
14,3,1,"Diagnostic Procedure, Treatment",AND,"Sample Collection, Diagnostic Tool",Diagnostic procedures by conventional endoscopy,include,cell and tissue sample collection by brush or biopsy forceps,Diagnostic procedures by conventional endoscopy include cell and tissue sample collection by brush or biopsy forceps,AND
15,3,1,Diagnostic Tool,AND,"Diagnostic Function, Therapeutic Function",Several different types of endoscopes,provide,additional diagnostic and therapeutic functions,Several different types of endoscopes provide additional diagnostic and therapeutic functions,AND
16,3,1,Diagnostic Tool,IMPLIES,Diagnostic Function,Ultrasound-equipped endoscopes,can evaluate,"blood flow or provide imaging of mucosal, submucosal, or extraluminal lesions","Ultrasound-equipped endoscopes can evaluate blood flow or provide imaging of mucosal, submucosal, or extraluminal lesions",IMPLIES
17,3,1,Diagnostic Tool,IMPLIES,Diagnostic Information,Endoscopic ultrasound,can provide information,the depth and extent of lesions,Endoscopic ultrasound can provide information the depth and extent of lesions,IMPLIES
18,3,1,Diagnostic Procedure,IMPLIES,Sample Collection,Fine-needle aspiration,can be done with,endoscopic ultrasound guidance,Fine-needle aspiration can be done with endoscopic ultrasound guidance,IMPLIES
19,4,1,"treatment, procedure",IMPLIES,"assessment, diagnostic procedure",Balloon-assisted enteroscopy,provides additional assessment of,the small intestine beyond push enteroscopy,Balloon-assisted enteroscopy provides additional assessment of the small intestine beyond push enteroscopy,IMPLIES
20,4,1,"treatment, procedure",USES,"medical device, instrument",Balloon-assisted enteroscopy,uses,an endoscope with one or two inflatable balloons attached to an overtube,Balloon-assisted enteroscopy uses an endoscope with one or two inflatable balloons attached to an overtube,USES
21,4,1,"procedure, action",CAUSES,"physical change, anatomical change",Inflation of the balloon,anchors to,the intestinal mucosa,Inflation of the balloon anchors to the intestinal mucosa,CAUSES
22,4,1,"procedure, action",CAUSES,"physical change, anatomical change",Pulling back of the inflated balloon,pulls,the small bowel over the overtube like a sleeve,Pulling back of the inflated balloon pulls the small bowel over the overtube like a sleeve,CAUSES
23,4,1,"procedure, action",CAUSES,"physical change, anatomical change",Pulling back of the inflated balloon,shortens and straightens,the small intestine,Pulling back of the inflated balloon shortens and straightens the small intestine,CAUSES
24,4,1,"procedure, treatment",ENABLES,"procedure, action",Balloon-assisted enteroscopy,enables,examination and potential therapeutic intervention of the entire small intestine,Balloon-assisted enteroscopy enables examination and potential therapeutic intervention of the entire small intestine,IMPLIES
25,5,1,"condition, risk factor",CAUSES,"recommendation, treatment",high risk of colon cancer,is a reason for,screening colonoscopy,high risk of colon cancer is a reason for screening colonoscopy,CAUSES
26,5,1,condition,THRESHOLD,"recommendation, treatment",age ≥ 45,is a threshold for,screening colonoscopy,age ≥ 45 is a threshold for screening colonoscopy,THRESHOLD
27,5,1,condition,CAUSES,recommendation,rising incidence of early-onset colorectal cancer,caused,lowering the recommended screening age from 50 to 45,rising incidence of early-onset colorectal cancer caused lowering the recommended screening age from 50 to 45,CAUSES
28,5,1,condition,NEGATES,recommendation,no risk factors or history of polyps,negates the need for,earlier colonoscopy intervals,no risk factors or history of polyps negates the need for earlier colonoscopy intervals,NEGATES
29,5,1,condition,CAUSES,recommendation,polyps found,causes,earlier colonoscopy intervals,polyps found causes earlier colonoscopy intervals,CAUSES
30,6,1,treatment,IMPLIES,condition,removal of foreign bodies,implies treatment for,foreign body presence,removal of foreign bodies implies treatment for foreign body presence,IMPLIES
31,6,1,treatment,IMPLIES,condition,hemostasis by hemoclips placement,implies treatment for,bleeding,hemostasis by hemoclips placement implies treatment for bleeding,IMPLIES
32,6,1,treatment,IMPLIES,condition,injection of medications,implies treatment for,various conditions,injection of medications implies treatment for various conditions,IMPLIES
33,6,1,treatment,IMPLIES,condition,hemostatic sprays,implies treatment for,bleeding,hemostatic sprays implies treatment for bleeding,IMPLIES
34,6,1,treatment,IMPLIES,condition,thermal coagulation,implies treatment for,bleeding,thermal coagulation implies treatment for bleeding,IMPLIES
35,6,1,treatment,IMPLIES,condition,laser photocoagulation,implies treatment for,bleeding,laser photocoagulation implies treatment for bleeding,IMPLIES
36,6,1,treatment,IMPLIES,condition,variceal banding,implies treatment for,esophageal varices,variceal banding implies treatment for esophageal varices,IMPLIES
37,6,1,treatment,IMPLIES,condition,sclerotherapy,implies treatment for,varicose veins,sclerotherapy implies treatment for varicose veins,IMPLIES
38,6,1,treatment,IMPLIES,condition,debulking of tumors by laser or bipolar electrocoagulation,implies treatment for,tumors,debulking of tumors by laser or bipolar electrocoagulation implies treatment for tumors,IMPLIES
39,6,1,treatment,IMPLIES,condition,ablative therapy of premalignant lesions,implies treatment for,premalignant lesions,ablative therapy of premalignant lesions implies treatment for premalignant lesions,IMPLIES
40,6,1,treatment,IMPLIES,condition,removal of polyps,implies treatment for,polyps,removal of polyps implies treatment for polyps,IMPLIES
41,6,1,treatment,IMPLIES,condition,mucosal and/or submucosal tissue resection,implies treatment for,tissue abnormalities,mucosal and/or submucosal tissue resection implies treatment for tissue abnormalities,IMPLIES
42,6,1,treatment,IMPLIES,condition,dilation of webs or strictures,implies treatment for,webs or strictures,dilation of webs or strictures implies treatment for webs or strictures,IMPLIES
43,6,1,treatment,IMPLIES,condition,stent placement,implies treatment for,obstructions,stent placement implies treatment for obstructions,IMPLIES
44,6,1,treatment,IMPLIES,condition,reduction of volvulus or intussusception,implies treatment for,volvulus or intussusception,reduction of volvulus or intussusception implies treatment for volvulus or intussusception,IMPLIES
45,6,1,treatment,IMPLIES,condition,decompression of acute or subacute colonic dilation,implies treatment for,colonic dilation,decompression of acute or subacute colonic dilation implies treatment for colonic dilation,IMPLIES
46,6,1,treatment,IMPLIES,condition,feeding tube placement,implies treatment for,feeding difficulties,feeding tube placement implies treatment for feeding difficulties,IMPLIES
47,6,1,treatment,IMPLIES,condition,drainage of pancreatic cysts,implies treatment for,pancreatic cysts,drainage of pancreatic cysts implies treatment for pancreatic cysts,IMPLIES
48,6,1,treatment,IMPLIES,condition,endoscopic bariatric procedures,implies treatment for,obesity,endoscopic bariatric procedures implies treatment for obesity,IMPLIES
49,6,1,treatment,IMPLIES,condition,endoscopic myotomy,implies treatment for,achalasia,endoscopic myotomy implies treatment for achalasia,IMPLIES
50,6,1,treatment,IMPLIES,condition,transoral incision-less fundoplication,implies treatment for,gastroesophageal reflux disease (GERD),transoral incision-less fundoplication implies treatment for gastroesophageal reflux disease (GERD),IMPLIES
51,7,1,condition,CONTRAINDICATES,treatment,shock,is an absolute contraindication to,endoscopy,shock is an absolute contraindication to endoscopy,NEGATES
52,7,1,condition,CONTRAINDICATES,treatment,acute myocardial infarction,is an absolute contraindication to,endoscopy,acute myocardial infarction is an absolute contraindication to endoscopy,NEGATES
53,7,1,condition,CONTRAINDICATES,treatment,peritonitis,is an absolute contraindication to,endoscopy,peritonitis is an absolute contraindication to endoscopy,NEGATES
54,7,1,condition,CONTRAINDICATES,treatment,acute perforation,is an absolute contraindication to,endoscopy,acute perforation is an absolute contraindication to endoscopy,NEGATES
55,7,1,condition,CONTRAINDICATES,treatment,fulminant colitis,is an absolute contraindication to,endoscopy,fulminant colitis is an absolute contraindication to endoscopy,NEGATES
56,7,1,condition,CONTRAINDICATES,treatment,poor patient cooperation,is a relative contraindication to,endoscopy,poor patient cooperation is a relative contraindication to endoscopy,NEGATES
57,7,1,condition,CONTRAINDICATES,treatment,coma (unless the patient is intubated),is a relative contraindication to,endoscopy,coma (unless the patient is intubated) is a relative contraindication to endoscopy,NEGATES
58,7,1,condition,CONTRAINDICATES,treatment,cardiac arrhythmias or recent myocardial ischemia,is a relative contraindication to,endoscopy,cardiac arrhythmias or recent myocardial ischemia is a relative contraindication to endoscopy,NEGATES
59,7,1,treatment,SAFE_WITH,treatment,diagnostic endoscopy,can be safely performed with,anticoagulants or chronic nonsteroidal anti-inflammatory drug therapy,diagnostic endoscopy can be safely performed with anticoagulants or chronic nonsteroidal anti-inflammatory drug therapy,NEGATES
60,7,1,treatment,REQUIRES_STOP,treatment,biopsy or photocoagulation,requires stopping,anticoagulants,biopsy or photocoagulation requires stopping anticoagulants,THRESHOLD
61,7,1,treatment,REQUIRES_STOP,treatment,colonoscopy,requires stopping,oral iron-containing medications,colonoscopy requires stopping oral iron-containing medications,THRESHOLD
62,7,1,substance,INTERACTS_WITH,food,iron,interacts with,certain green vegetables,iron interacts with certain green vegetables,INTERACTS_WITH
63,7,1,interaction,CAUSES,condition,interaction of iron with certain green vegetables,causes,sticky residue that is difficult to remove with a bowel preparation and interferes with visualization,interaction of iron with certain green vegetables causes sticky residue that is difficult to remove with a bowel preparation and interferes with visualization,CAUSES
64,8,1,"treatment, procedure",REQUIRES,"preparation, diet",endoscopy,requires,no solids for 8 hours and no liquids for 2 to 4 hours before the procedure,endoscopy requires no solids for 8 hours and no liquids for 2 to 4 hours before the procedure,THRESHOLD
65,8,1,"treatment, procedure",REQUIRES,"preparation, diet, treatment",colonoscopy,requires,cleansing of the colon,colonoscopy requires cleansing of the colon,THRESHOLD
66,8,1,"preparation, diet",INCLUDES,diet,cleansing of the colon,includes,a full or clear liquid diet for 24 to 48 hours,cleansing of the colon includes a full or clear liquid diet for 24 to 48 hours,IMPLIES
67,8,1,"preparation, diet",INCLUDES,treatment,cleansing of the colon,includes,"some type of laxative, with or without an enema","cleansing of the colon includes some type of laxative, with or without an enema",IMPLIES
68,8,1,treatment,USES,preparation,Bowel cleansing preparations,using,a high volume of an electrolyte-containing liquid,Bowel cleansing preparations using a high volume of an electrolyte-containing liquid,USES
69,8,1,preparation,VARIES,efficacy,The preparations,have varying degrees of,efficacy,The preparations have varying degrees of efficacy,IMPLIES
70,8,1,preparation,IMPROVES,"compliance, examination quality, detection rate",Giving preparations in a split-dose fashion,has been shown to improve,"patient compliance, examination quality, and adenoma detection rate","Giving preparations in a split-dose fashion has been shown to improve patient compliance, examination quality, and adenoma detection rate",CAUSES
71,9,1,"treatment, procedure",IMPLIES,"diagnostic tool, imaging technique",video capsule endoscopy,provides,diagnostic imaging of the small bowel,video capsule endoscopy provides diagnostic imaging of the small bowel,IMPLIES
72,9,1,"condition, symptom",CAUSES,need for diagnostic imaging,occult gastrointestinal bleeding,necessitates,diagnostic imaging,occult gastrointestinal bleeding necessitates diagnostic imaging,CAUSES
73,9,1,"treatment, procedure",AND,"condition, symptom",video capsule endoscopy,is useful for,detection of mucosal abnormalities,video capsule endoscopy is useful for detection of mucosal abnormalities,AND
74,9,1,"treatment, procedure",NEGATES,"common use, screening method",capsule endoscopy,is not commonly used as,a modality for colorectal cancer screening,capsule endoscopy is not commonly used as a modality for colorectal cancer screening,NEGATES
75,10,2,condition,IMPLIES,symptom,Colonic diverticulosis,is the presence of,one or more diverticula in the colon,Colonic diverticulosis is the presence of one or more diverticula in the colon,IMPLIES
76,10,2,condition,OR,symptom,Most diverticula,"are asymptomatic, but some",become inflamed or bleed,"Most diverticula are asymptomatic, but some become inflamed or bleed",OR
77,10,2,condition,DIAGNOSED BY,treatment,Colonic diverticulosis,Diagnosis is by,"colonoscopy, capsule endoscopy, barium enema, CT, or MRI","Colonic diverticulosis Diagnosis is by colonoscopy, capsule endoscopy, barium enema, CT, or MRI",RECOMMENDATION
78,10,2,condition,NEGATES,treatment,Asymptomatic diverticulosis,requires,no treatment,Asymptomatic diverticulosis requires no treatment,NEGATES
79,10,2,"condition, symptom",CAUSES,treatment,When symptoms develop,treatment varies depending on,clinical manifestations,When symptoms develop treatment varies depending on clinical manifestations,CAUSES
80,11,2,condition,CAUSES,anatomical feature,colonic diverticulum,is a saclike pouch of,colonic mucosa and submucosa that protrudes through the muscular layer of the colon,colonic diverticulum is a saclike pouch of colonic mucosa and submucosa that protrudes through the muscular layer of the colon,CAUSES
81,12,2,"condition, anatomical location",IMPLIES,"condition, anatomical location",diverticula in the large bowel,usually occur in,sigmoid portion of the colon,diverticula in the large bowel usually occur in sigmoid portion of the colon,IMPLIES
82,12,2,"condition, anatomical location",NEGATES,"condition, anatomical location",diverticula,rarely occur below,peritoneal reflection and involve the rectum,diverticula rarely occur below peritoneal reflection and involve the rectum,NEGATES
83,12,2,condition,THRESHOLD,condition,diverticula,are defined as giant diverticula if,diverticula > 4 cm in diameter,diverticula are defined as giant diverticula if diverticula > 4 cm in diameter,THRESHOLD
84,12,2,condition,IMPLIES,condition,colonic diverticulosis,usually have,several diverticula,colonic diverticulosis usually have several diverticula,IMPLIES
85,13,2,"condition, risk factor",IMPLIES,condition,increasing age,becomes more common with,diverticulosis,increasing age becomes more common with diverticulosis,IMPLIES
86,14,2,condition,CAUSES,condition,colonic diverticulosis,etiology of,multifactorial and not entirely known,colonic diverticulosis etiology of multifactorial and not entirely known,CAUSES
87,14,2,condition,IMPLIES,condition,symptomatic diverticular disease,correlation with,environmental factors,symptomatic diverticular disease correlation with environmental factors,IMPLIES
88,14,2,risk factor,CAUSES,condition,diet low in fiber,associated with,symptomatic diverticular disease,diet low in fiber associated with symptomatic diverticular disease,CAUSES
89,14,2,risk factor,CAUSES,condition,diet high in red meat,associated with,symptomatic diverticular disease,diet high in red meat associated with symptomatic diverticular disease,CAUSES
90,14,2,risk factor,CAUSES,condition,sedentary lifestyle,associated with,symptomatic diverticular disease,sedentary lifestyle associated with symptomatic diverticular disease,CAUSES
91,14,2,risk factor,CAUSES,condition,obesity,associated with,symptomatic diverticular disease,obesity associated with symptomatic diverticular disease,CAUSES
92,14,2,risk factor,CAUSES,condition,smoking,associated with,symptomatic diverticular disease,smoking associated with symptomatic diverticular disease,CAUSES
93,14,2,"risk factor, treatment",CAUSES,condition,use of NSAIDs,associated with,symptomatic diverticular disease,use of NSAIDs associated with symptomatic diverticular disease,CAUSES
94,14,2,"risk factor, treatment",CAUSES,condition,use of aspirin,associated with,symptomatic diverticular disease,use of aspirin associated with symptomatic diverticular disease,CAUSES
95,14,2,"risk factor, treatment",CAUSES,condition,use of acetaminophen,associated with,symptomatic diverticular disease,use of acetaminophen associated with symptomatic diverticular disease,CAUSES
96,14,2,"risk factor, treatment",CAUSES,condition,use of corticosteroids,associated with,symptomatic diverticular disease,use of corticosteroids associated with symptomatic diverticular disease,CAUSES
97,14,2,"risk factor, treatment",CAUSES,condition,use of opioids,associated with,symptomatic diverticular disease,use of opioids associated with symptomatic diverticular disease,CAUSES
98,14,2,risk factor,CAUSES,condition,heritable factors,possible risk factor for,symptomatic diverticular disease,heritable factors possible risk factor for symptomatic diverticular disease,CAUSES
99,14,2,risk factor,CAUSES,condition,alterations in colonic wall structure and motility,possible risk factor for,symptomatic diverticular disease,alterations in colonic wall structure and motility possible risk factor for symptomatic diverticular disease,CAUSES
100,15,2,"condition, anatomical feature",CAUSES,condition,increase in intraluminal pressure,causes,diverticula,increase in intraluminal pressure causes diverticula,CAUSES
101,15,2,condition,IMPLIES,anatomical feature,diverticula,leads to,mucosal extrusion through the weakest points of the muscular layer of the bowel,diverticula leads to mucosal extrusion through the weakest points of the muscular layer of the bowel,IMPLIES
102,15,2,anatomical feature,AND,anatomical feature,weakest points of the muscular layer of the bowel,areas adjacent to,intramural blood vessels,weakest points of the muscular layer of the bowel areas adjacent to intramural blood vessels,AND
103,16,2,"condition, risk factor",IMPLIES,symptom,diverticulosis,are asymptomatic or have only intermittent constipation,asymptomatic or intermittent constipation,diverticulosis are asymptomatic or have only intermittent constipation asymptomatic or intermittent constipation,IMPLIES
104,16,2,condition,CAUSES,symptom,diverticulosis,become symptomatic with,pain or bleeding,diverticulosis become symptomatic with pain or bleeding,CAUSES
105,16,2,condition,CAUSES,condition,diverticulosis,when,inflammatory or hemorrhagic complications develop,diverticulosis when inflammatory or hemorrhagic complications develop,CAUSES
106,17,2,condition,CAUSES,symptom,diverticulosis,sometimes develop,"nonspecific gastrointestinal (GI) symptoms, including abdominal pain, bloating, constipation, diarrhea, and passage of mucus from the rectum","diverticulosis sometimes develop nonspecific gastrointestinal (GI) symptoms, including abdominal pain, bloating, constipation, diarrhea, and passage of mucus from the rectum",CAUSES
107,17,2,condition,IMPLIES,condition,diverticulosis with nonspecific GI symptoms,is sometimes referred to as,symptomatic uncomplicated diverticular disease (SUDD),diverticulosis with nonspecific GI symptoms is sometimes referred to as symptomatic uncomplicated diverticular disease (SUDD),IMPLIES
108,17,2,symptom,OR,condition,nonspecific GI symptoms,are due to,"another disorder (eg, irritable bowel syndrome)","nonspecific GI symptoms are due to another disorder (eg, irritable bowel syndrome)",OR
109,17,2,condition,NEGATES,condition,presence of diverticula,is coincidental rather than causal,nonspecific GI symptoms,presence of diverticula is coincidental rather than causal nonspecific GI symptoms,NEGATES
110,18,2,"condition, risk factor",CAUSES,condition,Colonic diverticular disease,complications of,"diverticulitis, diverticular bleeding, and segmental colitis associated with diverticular disease (SCAD)","Colonic diverticular disease complications of diverticulitis, diverticular bleeding, and segmental colitis associated with diverticular disease (SCAD)",CAUSES
111,18,2,risk factor,IMPLIES,condition,Smoking,more common among people who,complications of colonic diverticular disease,Smoking more common among people who complications of colonic diverticular disease,IMPLIES
112,18,2,risk factor,IMPLIES,condition,Obesity,more common among people who,complications of colonic diverticular disease,Obesity more common among people who complications of colonic diverticular disease,IMPLIES
113,18,2,"risk factor, condition",IMPLIES,condition,HIV infection,more common among people who,complications of colonic diverticular disease,HIV infection more common among people who complications of colonic diverticular disease,IMPLIES
114,18,2,"risk factor, treatment",IMPLIES,condition,NSAIDs use,more common among people who,complications of colonic diverticular disease,NSAIDs use more common among people who complications of colonic diverticular disease,IMPLIES
115,18,2,treatment,IMPLIES,condition,Cancer chemotherapy,more common among people who are undergoing,complications of colonic diverticular disease,Cancer chemotherapy more common among people who are undergoing complications of colonic diverticular disease,IMPLIES
116,19,2,condition,CAUSES,symptom,Diverticulitis,is,painful inflammation of a diverticulum,Diverticulitis is painful inflammation of a diverticulum,CAUSES
117,20,2,condition,CAUSES,symptom,Diverticulosis,occurs in,Diverticular bleeding,Diverticulosis occurs in Diverticular bleeding,CAUSES
118,20,2,condition,IMPLIES,condition,Diverticulosis,associated with,Segmental colitis associated with diverticular disease (SCAD),Diverticulosis associated with Segmental colitis associated with diverticular disease (SCAD),IMPLIES
119,20,2,condition,CAUSES,symptom,Segmental colitis associated with diverticular disease (SCAD),refers to manifestations of,"colitis (eg, hematochezia, abdominal pain, diarrhea)","Segmental colitis associated with diverticular disease (SCAD) refers to manifestations of colitis (eg, hematochezia, abdominal pain, diarrhea)",CAUSES
120,20,2,condition,THRESHOLD,condition,Diverticulosis,develop in a few (1%) patients with,Segmental colitis associated with diverticular disease (SCAD),Diverticulosis develop in a few (1%) patients with Segmental colitis associated with diverticular disease (SCAD),THRESHOLD
